{
  "schema": "fleet-capacity-admission-request/v1",
  "request_id": "cloudvore:fixture-0001",
  "project": "cloudvore",
  "lane": "bounded-candidate-builder",
  "subject_digest": "sha256:cccccccccccccccccccccccccccccccccccccccccccccccccccccccccccccccc",
  "role": "IMPLEMENT",
  "priority": "PRODUCT_WORK",
  "profile": {
    "provider": "anthropic",
    "quota_domain": "anthropic:sha256:aaaaaaaaaaaaaaaaaaaaaaaaaaaaaaaaaaaaaaaaaaaaaaaaaaaaaaaaaaaaaaaa",
    "independence_class": "anthropic",
    "requested_model": "claude-opus-5",
    "requested_effort": "max",
    "transport": "claude-code-cli@2.1.214"
  },
  "issued_at": "2026-08-18T16:00:00Z",
  "expires_at": "2026-08-18T17:00:00Z",
  "budget": {
    "max_wall_seconds": 900,
    "max_turns": 12,
    "max_context_tokens": 120000,
    "window_estimates": {"five_hour": 0.05, "weekly": 0.01}
  },
  "quality_contract": {
    "requires_exact_profile": true,
    "role_cell_evidence": "project-local:role-cell-42"
  },
  "owner_override": false
}

